{
  "version": "0.1",
  "base_model": "power_generation_hydro",
  "data_changes": [
    {
      "op": "scale",
      "table": "thermal_types",
      "column": "units_available",
      "where": {
        "type": [
          "Thermal0",
          "Thermal1",
          "Thermal2"
        ]
      },
      "factor": 0.8
    }
  ],
  "note": "The total number of thermal units running summed over everything is bounded by 80. This is a data change on the units_available column for all thermal types, scaled by 0.8 to represent a maximum of 80 units."
}