{
  "version": "0.1",
  "base_model": "manpower_planning",
  "rules": [
    {
      "name": "total_short_time_limit",
      "measure": "short_time",
      "scope": {},
      "sense": "<=",
      "value": 240
    }
  ],
  "note": "A total limit on short-time workers across all years and skill levels."
}