{
  "version": "0.1",
  "base_model": "power_generation_hydro",
  "objective": [
    {
      "sense": "min",
      "measure": "original"
    },
    {
      "sense": "min",
      "measure": "reservoir_level",
      "scope": {
        "period": "09-15"
      }
    }
  ],
  "note": "Keep total generating cost at its minimum, then minimise the reservoir level for period 09-15."
}