{
 "version": "0.1",
 "base_model": "battery_scheduling",
 "fixed_decisions": [
  {
   "measure": "charge",
   "scope": {
    "hour": "02-03"
   },
   "value": 0
  },
  {
   "measure": "discharge",
   "scope": {
    "hour": "19-20"
   },
   "value": 1.1
  }
 ],
 "note": "Fixed decisions set specific charge and discharge power levels for designated hours."
}