{
 "version": "0.1",
 "base_model": "factory_planning",
 "data_changes": [
  {
   "op": "set",
   "table": "products",
   "column": "profit_per_unit",
   "where": {
    "product": "Prod2"
   },
   "value": 4
  }
 ],
 "note": "A price change affecting the profit contribution of a product is captured by setting the profit_per_unit parameter for that product."
}