{
  "version": "0.1",
  "base_model": "factory_planning_2",
  "data_changes": [
    {
      "op": "scale",
      "table": "max_sales",
      "column": "max_sales",
      "where": {
        "month": "Mar",
        "product": "Prod5"
      },
      "factor": 1.1
    }
  ],
  "note": "A 10% increase in the market limit for Prod5 in March is modeled as a scale operation on the max_sales table."
}