{"version":"0.1","base_model":"manpower_planning","data_changes":[{"op":"scale","table":"skills","column":"current_strength","where":{"skill":"skilled"},"factor":1.2},{"op":"scale","table":"costs","column":"short_time_cost","where":{"skill":["unskilled","semi_skilled","skilled"]},"factor":0.9}],"note":"Increase skilled current strength by 20% and reduce short-time cost by 10%."}