{"version":"0.1","base_model":"factory_planning","data_changes":[{"op":"set","table":"process_hours","column":"hours_per_unit","where":{"machine":"horiDrill","product":"Prod3"},"value":0.4},{"op":"set","table":"max_sales","column":"max_sales","where":{"month":"Feb","product":"Prod7"},"value":200}],"note":"Process change: Prod3 horizontal-drill time set to 0.4 h/unit. Market limit for Prod7 in February set to 200 units."}
