{
 "version": "0.1",
 "base_model": "multiple_knapsack",
 "rules": [
  {
   "name": "item1_placement_limit",
   "measure": "x",
   "scope": {
    "item": "item1"
   },
   "sense": "<=",
   "relative_to": {
    "measure": "x",
    "scope": {
     "item": "*"
    }
   },
   "factor": 0.05
  },
  {
   "name": "bin1_placement_limit",
   "measure": "x",
   "scope": {
    "bin": "bin1"
   },
   "sense": "<=",
   "relative_to": {
    "measure": "x",
    "scope": {
     "bin": "bin0"
    }
   },
   "factor": 0.8
  }
 ],
 "note": "Rules bound the SUM of a decision measure over a scope; a relative rule compares two such sums."
}